<?xml version="1.0" encoding="utf-8" standalone="yes"?><rss version="2.0" xmlns:atom="http://www.w3.org/2005/Atom"><channel><title>Dailies on</title><link>https://quartz.jzhao.xyz/daily/</link><description>Recent content in Dailies on</description><generator>Hugo -- gohugo.io</generator><language>en-us</language><atom:link href="https://quartz.jzhao.xyz/daily/index.xml" rel="self" type="application/rss+xml"/><item><title/><link>https://quartz.jzhao.xyz/Daily/2022-11-13/</link><pubDate>Mon, 01 Jan 0001 00:00:00 +0000</pubDate><guid>https://quartz.jzhao.xyz/Daily/2022-11-13/</guid><description>13-11-22 | Sunday https://youtube.com/watch?v=W_leEJHBZW4&amp;feature=share
[[Source/Atomic habits]] says it takes 66 days to form a habit.
https://docs.google.com/document/d/18FiJbYn53fTtPmphfdCKT2TMWH-8Y2L-MLqDk-MFV4s/preview?pru=AAABhJR1zHo*7rKvjhidQ1BxvRh82C9fyg#</description></item><item><title/><link>https://quartz.jzhao.xyz/Daily/2022-10-18/</link><pubDate>Mon, 01 Jan 0001 00:00:00 +0000</pubDate><guid>https://quartz.jzhao.xyz/Daily/2022-10-18/</guid><description>[[products/food forest/Pruning]] Pruned the fig and plum [[products/food forest/Transplant]]ed a couple walnuts
Figured out how to publish my vault on github pages!</description></item><item><title/><link>https://quartz.jzhao.xyz/Daily/2022-10-20/</link><pubDate>Mon, 01 Jan 0001 00:00:00 +0000</pubDate><guid>https://quartz.jzhao.xyz/Daily/2022-10-20/</guid><description>20-10-22 | Thursday https://nfs.unl.edu/publication-type/windbreaks
from the permaculture design course via verge permaculture &amp;ldquo;good enough for now safe enough to try.</description></item><item><title/><link>https://quartz.jzhao.xyz/Daily/2022-10-21/</link><pubDate>Mon, 01 Jan 0001 00:00:00 +0000</pubDate><guid>https://quartz.jzhao.xyz/Daily/2022-10-21/</guid><description>21-10-22 | Friday Cleaned up some of the notes. I think the templates Are working better with fewer. I will add a link from the home page to the daily notes Added a image for meditation.</description></item><item><title/><link>https://quartz.jzhao.xyz/Daily/2022-10-22/</link><pubDate>Mon, 01 Jan 0001 00:00:00 +0000</pubDate><guid>https://quartz.jzhao.xyz/Daily/2022-10-22/</guid><description>22-10-22 | Saturday Three cut pruning method
Do we want to grow hemp. And is this the replacement for eucalyptus for portugal?</description></item><item><title/><link>https://quartz.jzhao.xyz/Daily/2022-10-23/</link><pubDate>Mon, 01 Jan 0001 00:00:00 +0000</pubDate><guid>https://quartz.jzhao.xyz/Daily/2022-10-23/</guid><description>23-10-22 | Sunday https://www.miio.pt/graph/today
seville walking tour
Spent some time today testing out how to charge our EV , one test was at the EDP charging station and then another session at the tesla station a little ways away.</description></item><item><title/><link>https://quartz.jzhao.xyz/Daily/2022-10-24/</link><pubDate>Mon, 01 Jan 0001 00:00:00 +0000</pubDate><guid>https://quartz.jzhao.xyz/Daily/2022-10-24/</guid><description>24-10-22 | Monday fasting your way to 100
Shinzen Young a meditation teacher and writer. [[Meditation]]</description></item><item><title/><link>https://quartz.jzhao.xyz/Daily/2022-10-25/</link><pubDate>Mon, 01 Jan 0001 00:00:00 +0000</pubDate><guid>https://quartz.jzhao.xyz/Daily/2022-10-25/</guid><description>25-10-22 | Tuesday Started our first real road trip with via our electric vehicle. We are charging the car at a Super charging station on our way to algave.</description></item><item><title/><link>https://quartz.jzhao.xyz/Daily/2022-10-26/</link><pubDate>Mon, 01 Jan 0001 00:00:00 +0000</pubDate><guid>https://quartz.jzhao.xyz/Daily/2022-10-26/</guid><description>26-10-22 | Wednesday [Intro to permaculture] ( https://canvas.oregonstate.edu/courses/1807270?utm_campaign=Permaculture&amp;utm_medium=email&amp;_hsmi=206927809&amp;_hsenc=p2ANqtz-8m35Xx66VBICYRdNzQZxuucSj0fJIc4HS-3zSo4NGy8XFQLkNhQkpuDEQAsWrSa3fdtNllVnl0P4UiuV-1jxlG7WAwGg&amp;utm_content=206927809&amp;utm_source=hs_automation)
a wholesale store/chain in Portugal</description></item><item><title/><link>https://quartz.jzhao.xyz/Daily/2022-10-29/</link><pubDate>Mon, 01 Jan 0001 00:00:00 +0000</pubDate><guid>https://quartz.jzhao.xyz/Daily/2022-10-29/</guid><description>29-10-22 | Saturday Working to sort out how to charge the car on a trip doing the least damage.
https://www.</description></item><item><title/><link>https://quartz.jzhao.xyz/Daily/2022-10-30/</link><pubDate>Mon, 01 Jan 0001 00:00:00 +0000</pubDate><guid>https://quartz.jzhao.xyz/Daily/2022-10-30/</guid><description>![[Assets/Smoothies.pdf]]
30-10-22 | Sunday Thinking about a trip to Madrid Ideas for enjoying a new city.
A route to Madrid from Obidos</description></item><item><title/><link>https://quartz.jzhao.xyz/Daily/2022-10-31/</link><pubDate>Mon, 01 Jan 0001 00:00:00 +0000</pubDate><guid>https://quartz.jzhao.xyz/Daily/2022-10-31/</guid><description>31-10-22 | Monday Our harvest, well we harvested them a while back and have tried to dry them for a while as it has been rainy for the last week.</description></item><item><title/><link>https://quartz.jzhao.xyz/Daily/2022-11-01/</link><pubDate>Mon, 01 Jan 0001 00:00:00 +0000</pubDate><guid>https://quartz.jzhao.xyz/Daily/2022-11-01/</guid><description>01-11-22 | Tuesday Standard Connectivity:
Tesla Over-the-air (OTA) Updates Bluetooth Capability Navigation (WiFi + LTE) Video Streaming (WiFi Only) Caraoke (WiFi Only) Music Streaming (WiFi Only) Internet Browser (WiFi Only) The majority of the features available in Standard Connectivity can only be accessed via wifi.</description></item><item><title/><link>https://quartz.jzhao.xyz/Daily/2022-11-03/</link><pubDate>Mon, 01 Jan 0001 00:00:00 +0000</pubDate><guid>https://quartz.jzhao.xyz/Daily/2022-11-03/</guid><description>03-11-22 | Thursday Pruning olive trees
https://youtube.com/watch?v=YxpmMP7PJ7E&amp;feature=share
How to get SNS
https://insideevs.com/news/507489/tesla-model3-charging-faster-ccs2/
References:
Tags: #portugal #sns #healthcare #immagration #EV #charging #pruning #olivetrees</description></item><item><title/><link>https://quartz.jzhao.xyz/Daily/2022-11-04/</link><pubDate>Mon, 01 Jan 0001 00:00:00 +0000</pubDate><guid>https://quartz.jzhao.xyz/Daily/2022-11-04/</guid><description>04-11-22 | Friday https://planbio.eu/produto/planeador-de-horta-biologica-planeador-de-ervas-aromaticas/
Portugués plants and herb almanac, kinda thing
Tags: #plants, #herbs, #planting , #timing, #soil, #datea</description></item><item><title/><link>https://quartz.jzhao.xyz/Daily/2022-11-05/</link><pubDate>Mon, 01 Jan 0001 00:00:00 +0000</pubDate><guid>https://quartz.jzhao.xyz/Daily/2022-11-05/</guid><description>05-11-22 | Saturday https://turismo.obidos.pt/percursos-pedestres/</description></item><item><title/><link>https://quartz.jzhao.xyz/Daily/2022-11-09/</link><pubDate>Mon, 01 Jan 0001 00:00:00 +0000</pubDate><guid>https://quartz.jzhao.xyz/Daily/2022-11-09/</guid><description> https://youtube.com/watch?v=lupPd8SsZNc&amp;feature=share
08:18: Is it gonna really work this time or not</description></item><item><title/><link>https://quartz.jzhao.xyz/Daily/2022-11-11/</link><pubDate>Mon, 01 Jan 0001 00:00:00 +0000</pubDate><guid>https://quartz.jzhao.xyz/Daily/2022-11-11/</guid><description>11-11-22 | Friday The Biology of Belief Author : Bruce Liton
Techniques: ETF, mindfulness, hypnosis , Energy psychology , ETF, EMDR, EFT, Avitar, TFT, Body talk, psych https://pubmed.</description></item><item><title/><link>https://quartz.jzhao.xyz/Daily/2022-11-12/</link><pubDate>Mon, 01 Jan 0001 00:00:00 +0000</pubDate><guid>https://quartz.jzhao.xyz/Daily/2022-11-12/</guid><description>Heard our first owl in Portugal !
This file is not processing , and now the text is disappearing &amp;hellip; Thinking the constraint in the spiritual process is like matted hair, u just don&amp;rsquo;t notice that much after a while.</description></item><item><title/><link>https://quartz.jzhao.xyz/Daily/2022-11-14/</link><pubDate>Mon, 01 Jan 0001 00:00:00 +0000</pubDate><guid>https://quartz.jzhao.xyz/Daily/2022-11-14/</guid><description>14-11-22 | Monday went to play pool with the guys. The bar was closed so we had to find another one.</description></item><item><title/><link>https://quartz.jzhao.xyz/Daily/2022-11-15/</link><pubDate>Mon, 01 Jan 0001 00:00:00 +0000</pubDate><guid>https://quartz.jzhao.xyz/Daily/2022-11-15/</guid><description>15-11-22 | Tuesday Add mind maps to [[learning]] https://irishiggins.com/6-journaling-prompts-for-decluttering-emotional-blocks/</description></item><item><title/><link>https://quartz.jzhao.xyz/Daily/2022-11-16/</link><pubDate>Mon, 01 Jan 0001 00:00:00 +0000</pubDate><guid>https://quartz.jzhao.xyz/Daily/2022-11-16/</guid><description>16-11-22 | Wednesday https://youtube.com/watch?v=ltuqXTwWsZ8&amp;feature=share
Mind map tools: https://crm.org/news/best-mind-mapping-software
https://zapier.com/blog/best-mind-mapping-software/
https://app.mindmup.com/
Pruning Apricot trees: https://www.gardeningknowhow.com/edible/fruits/apricots/pruning-apricot-trees.htm
Coggle for mind map beginners and occasional use</description></item><item><title/><link>https://quartz.jzhao.xyz/Daily/2022-11-17/</link><pubDate>Mon, 01 Jan 0001 00:00:00 +0000</pubDate><guid>https://quartz.jzhao.xyz/Daily/2022-11-17/</guid><description>17-11-22 | Thursday</description></item><item><title/><link>https://quartz.jzhao.xyz/Daily/2022-11-18/</link><pubDate>Mon, 01 Jan 0001 00:00:00 +0000</pubDate><guid>https://quartz.jzhao.xyz/Daily/2022-11-18/</guid><description>18-11-22 | Friday Suffer from a cold today and went to the Pharmacy and got some cough syrup and ibuprofen with some antihistamines.</description></item><item><title/><link>https://quartz.jzhao.xyz/Daily/2022-11-19/</link><pubDate>Mon, 01 Jan 0001 00:00:00 +0000</pubDate><guid>https://quartz.jzhao.xyz/Daily/2022-11-19/</guid><description>19-11-22 | Saturday 1 2 3 Task Where !completed Group by file.link This is kinda crazy task&amp;hellip; cmd-l https://www.</description></item><item><title/><link>https://quartz.jzhao.xyz/Daily/2022-11-20/</link><pubDate>Mon, 01 Jan 0001 00:00:00 +0000</pubDate><guid>https://quartz.jzhao.xyz/Daily/2022-11-20/</guid><description>20-11-22 | Sunday In the beginning on my mind 1 List from #onmymind Tasks 1 2 3 Task Where !</description></item><item><title/><link>https://quartz.jzhao.xyz/Daily/2022-11-21/</link><pubDate>Mon, 01 Jan 0001 00:00:00 +0000</pubDate><guid>https://quartz.jzhao.xyz/Daily/2022-11-21/</guid><description>21-11-22 | Monday In the beginning on my mind 1 List from #onmymind Tasks 1 2 3 Task Where !</description></item><item><title/><link>https://quartz.jzhao.xyz/Daily/2022-11-22/</link><pubDate>Mon, 01 Jan 0001 00:00:00 +0000</pubDate><guid>https://quartz.jzhao.xyz/Daily/2022-11-22/</guid><description>22-11-22 | Tuesday In the beginning on my mind 1 List from #onmymind Tasks 1 2 3 Task Where !</description></item><item><title/><link>https://quartz.jzhao.xyz/Daily/2022-11-23/</link><pubDate>Mon, 01 Jan 0001 00:00:00 +0000</pubDate><guid>https://quartz.jzhao.xyz/Daily/2022-11-23/</guid><description>23-11-22 | Wednesday In the beginning on my mind 1 List from #onmymind Tasks 1 2 3 Task Where !</description></item><item><title/><link>https://quartz.jzhao.xyz/Daily/2022-11-24/</link><pubDate>Mon, 01 Jan 0001 00:00:00 +0000</pubDate><guid>https://quartz.jzhao.xyz/Daily/2022-11-24/</guid><description>24-11-22 | Thursday In the beginning on my mind 1 List from #onmymind Tasks 1 2 3 Task Where !</description></item><item><title/><link>https://quartz.jzhao.xyz/Daily/2022-11-25/</link><pubDate>Mon, 01 Jan 0001 00:00:00 +0000</pubDate><guid>https://quartz.jzhao.xyz/Daily/2022-11-25/</guid><description>25-11-22 | Friday In the beginning on my mind 1 List from #onmymind Tasks 1 2 3 Task Where !</description></item><item><title/><link>https://quartz.jzhao.xyz/Daily/2022-11-26/</link><pubDate>Mon, 01 Jan 0001 00:00:00 +0000</pubDate><guid>https://quartz.jzhao.xyz/Daily/2022-11-26/</guid><description>26-11-22 | Saturday In the beginning on my mind 1 List from #onmymind Tasks 1 2 3 Task Where !</description></item><item><title/><link>https://quartz.jzhao.xyz/Daily/2022-11-27/</link><pubDate>Mon, 01 Jan 0001 00:00:00 +0000</pubDate><guid>https://quartz.jzhao.xyz/Daily/2022-11-27/</guid><description>27-11-22 | Sunday In the beginning on my mind 1 List from #onmymind Tasks 1 2 3 Task Where !</description></item><item><title/><link>https://quartz.jzhao.xyz/Daily/2022-11-28/</link><pubDate>Mon, 01 Jan 0001 00:00:00 +0000</pubDate><guid>https://quartz.jzhao.xyz/Daily/2022-11-28/</guid><description>28-11-22 | Monday In the beginning on my mind 1 List from #onmymind Tasks 1 2 3 Task Where !</description></item><item><title/><link>https://quartz.jzhao.xyz/Daily/2022-11-29/</link><pubDate>Mon, 01 Jan 0001 00:00:00 +0000</pubDate><guid>https://quartz.jzhao.xyz/Daily/2022-11-29/</guid><description>29-11-22 | Tuesday In the beginning on my mind 1 List from #onmymind Tasks 1 2 3 Task Where !</description></item><item><title/><link>https://quartz.jzhao.xyz/Daily/2022-11-30/</link><pubDate>Mon, 01 Jan 0001 00:00:00 +0000</pubDate><guid>https://quartz.jzhao.xyz/Daily/2022-11-30/</guid><description>29-11-22 | Tuesday In the beginning on my mind 1 List from #onmymind Tasks 1 2 3 Task Where !</description></item><item><title/><link>https://quartz.jzhao.xyz/Daily/2022-12-01/</link><pubDate>Mon, 01 Jan 0001 00:00:00 +0000</pubDate><guid>https://quartz.jzhao.xyz/Daily/2022-12-01/</guid><description>01-12-22 | Thursday In the beginning on my mind 1 List from #onmymind Tasks 1 2 3 Task Where !</description></item><item><title/><link>https://quartz.jzhao.xyz/Daily/2022-12-02/</link><pubDate>Mon, 01 Jan 0001 00:00:00 +0000</pubDate><guid>https://quartz.jzhao.xyz/Daily/2022-12-02/</guid><description>02-12-22 | Friday In the beginning on my mind 1 List from #onmymind Tasks 1 2 3 Task Where !</description></item><item><title/><link>https://quartz.jzhao.xyz/Daily/2022-12-03/</link><pubDate>Mon, 01 Jan 0001 00:00:00 +0000</pubDate><guid>https://quartz.jzhao.xyz/Daily/2022-12-03/</guid><description>03-12-22 | Saturday In the beginning on my mind 1 List from #onmymind Tasks 1 2 3 Task Where !</description></item><item><title/><link>https://quartz.jzhao.xyz/Daily/2022-12-04/</link><pubDate>Mon, 01 Jan 0001 00:00:00 +0000</pubDate><guid>https://quartz.jzhao.xyz/Daily/2022-12-04/</guid><description>04-12-22 | Sunday In the beginning on my mind 1 List from #onmymind Tasks 1 2 3 Task Where !</description></item><item><title/><link>https://quartz.jzhao.xyz/Daily/2022-12-05/</link><pubDate>Mon, 01 Jan 0001 00:00:00 +0000</pubDate><guid>https://quartz.jzhao.xyz/Daily/2022-12-05/</guid><description>05-12-22 | Monday In the beginning on my mind 1 List from #onmymind Tasks 1 2 3 Task Where !</description></item><item><title/><link>https://quartz.jzhao.xyz/Daily/2022-12-06/</link><pubDate>Mon, 01 Jan 0001 00:00:00 +0000</pubDate><guid>https://quartz.jzhao.xyz/Daily/2022-12-06/</guid><description>06-12-22 | Tuesday In the beginning on my mind 1 List from #onmymind Tasks 1 2 3 Task Where !</description></item><item><title/><link>https://quartz.jzhao.xyz/Daily/2022-12-07/</link><pubDate>Mon, 01 Jan 0001 00:00:00 +0000</pubDate><guid>https://quartz.jzhao.xyz/Daily/2022-12-07/</guid><description>07-12-22 | Wednesday In the beginning on my mind 1 List from #onmymind Tasks 1 2 3 Task Where !</description></item><item><title/><link>https://quartz.jzhao.xyz/Daily/2022-12-08/</link><pubDate>Mon, 01 Jan 0001 00:00:00 +0000</pubDate><guid>https://quartz.jzhao.xyz/Daily/2022-12-08/</guid><description>08-12-22 | Thursday In the beginning on my mind 1 List from #onmymind Tasks 1 2 3 Task Where !</description></item><item><title/><link>https://quartz.jzhao.xyz/Daily/2022-12-09/</link><pubDate>Mon, 01 Jan 0001 00:00:00 +0000</pubDate><guid>https://quartz.jzhao.xyz/Daily/2022-12-09/</guid><description>09-12-22 | Friday In the beginning on my mind 1 List from #onmymind Tasks 1 2 3 Task Where !</description></item><item><title/><link>https://quartz.jzhao.xyz/Daily/2022-12-10/</link><pubDate>Mon, 01 Jan 0001 00:00:00 +0000</pubDate><guid>https://quartz.jzhao.xyz/Daily/2022-12-10/</guid><description>10-12-22 | Saturday In the beginning on my mind 1 List from #onmymind Tasks 1 2 3 Task Where !</description></item><item><title/><link>https://quartz.jzhao.xyz/Daily/2022-12-11/</link><pubDate>Mon, 01 Jan 0001 00:00:00 +0000</pubDate><guid>https://quartz.jzhao.xyz/Daily/2022-12-11/</guid><description>11-12-22 | Sunday In the beginning on my mind 1 List from #onmymind Tasks 1 2 3 Task Where !</description></item><item><title/><link>https://quartz.jzhao.xyz/Daily/2022-12-12/</link><pubDate>Mon, 01 Jan 0001 00:00:00 +0000</pubDate><guid>https://quartz.jzhao.xyz/Daily/2022-12-12/</guid><description>14-12-22 | Wednesday In the beginning on my mind 1 List from #onmymind Tasks 1 2 3 Task Where !</description></item><item><title/><link>https://quartz.jzhao.xyz/Daily/2022-12-13/</link><pubDate>Mon, 01 Jan 0001 00:00:00 +0000</pubDate><guid>https://quartz.jzhao.xyz/Daily/2022-12-13/</guid><description>14-12-22 | Wednesday In the beginning on my mind 1 List from #onmymind Tasks 1 2 3 Task Where !</description></item><item><title/><link>https://quartz.jzhao.xyz/Daily/2022-12-14/</link><pubDate>Mon, 01 Jan 0001 00:00:00 +0000</pubDate><guid>https://quartz.jzhao.xyz/Daily/2022-12-14/</guid><description>14-12-22 | Wednesday In the beginning on my mind 1 List from #onmymind Tasks 1 2 3 Task Where !</description></item><item><title/><link>https://quartz.jzhao.xyz/Daily/2022-12-15/</link><pubDate>Mon, 01 Jan 0001 00:00:00 +0000</pubDate><guid>https://quartz.jzhao.xyz/Daily/2022-12-15/</guid><description>15-12-22 | Thursday In the beginning on my mind 1 List from #onmymind Tasks 1 2 3 Task Where !</description></item><item><title/><link>https://quartz.jzhao.xyz/Daily/2022-12-16/</link><pubDate>Mon, 01 Jan 0001 00:00:00 +0000</pubDate><guid>https://quartz.jzhao.xyz/Daily/2022-12-16/</guid><description>16-12-22 | Friday In the beginning on my mind 1 List from #onmymind Tasks 1 2 3 Task Where !</description></item><item><title/><link>https://quartz.jzhao.xyz/Daily/2022-12-17/</link><pubDate>Mon, 01 Jan 0001 00:00:00 +0000</pubDate><guid>https://quartz.jzhao.xyz/Daily/2022-12-17/</guid><description>17-12-22 | Saturday In the beginning on my mind 1 List from #onmymind Tasks 1 2 3 Task Where !</description></item><item><title/><link>https://quartz.jzhao.xyz/Daily/2022-12-18/</link><pubDate>Mon, 01 Jan 0001 00:00:00 +0000</pubDate><guid>https://quartz.jzhao.xyz/Daily/2022-12-18/</guid><description>18-12-22 | Sunday In the beginning on my mind 1 List from #onmymind Tasks 1 2 3 Task Where !</description></item><item><title/><link>https://quartz.jzhao.xyz/Daily/2022-12-19/</link><pubDate>Mon, 01 Jan 0001 00:00:00 +0000</pubDate><guid>https://quartz.jzhao.xyz/Daily/2022-12-19/</guid><description>19-12-22 | Monday In the beginning on my mind 1 List from #onmymind Tasks 1 2 3 Task Where !</description></item><item><title/><link>https://quartz.jzhao.xyz/Daily/2022-12-20/</link><pubDate>Mon, 01 Jan 0001 00:00:00 +0000</pubDate><guid>https://quartz.jzhao.xyz/Daily/2022-12-20/</guid><description>19-12-22 | Monday In the beginning on my mind 1 List from #onmymind Tasks 1 2 3 Task Where !</description></item><item><title/><link>https://quartz.jzhao.xyz/Daily/2022-12-21/</link><pubDate>Mon, 01 Jan 0001 00:00:00 +0000</pubDate><guid>https://quartz.jzhao.xyz/Daily/2022-12-21/</guid><description>21-12-22 | Wednesday In the beginning on my mind 1 List from #onmymind Tasks 1 2 3 Task Where !</description></item><item><title/><link>https://quartz.jzhao.xyz/Daily/2022-12-22/</link><pubDate>Mon, 01 Jan 0001 00:00:00 +0000</pubDate><guid>https://quartz.jzhao.xyz/Daily/2022-12-22/</guid><description>21-12-22 | Wednesday In the beginning on my mind 1 List from #onmymind Tasks 1 2 3 Task Where !</description></item><item><title/><link>https://quartz.jzhao.xyz/Daily/2022-12-23/</link><pubDate>Mon, 01 Jan 0001 00:00:00 +0000</pubDate><guid>https://quartz.jzhao.xyz/Daily/2022-12-23/</guid><description>23-12-22 | Friday In the beginning on my mind 1 List from #onmymind Tasks 1 2 3 Task Where !</description></item><item><title/><link>https://quartz.jzhao.xyz/Daily/2022-12-24/</link><pubDate>Mon, 01 Jan 0001 00:00:00 +0000</pubDate><guid>https://quartz.jzhao.xyz/Daily/2022-12-24/</guid><description>24-12-22 | Saturday In the beginning on my mind 1 List from #onmymind Tasks 1 2 3 Task Where !</description></item><item><title/><link>https://quartz.jzhao.xyz/Daily/2022-12-25/</link><pubDate>Mon, 01 Jan 0001 00:00:00 +0000</pubDate><guid>https://quartz.jzhao.xyz/Daily/2022-12-25/</guid><description>25-12-22 | Sunday In the beginning on my mind 1 List from #onmymind Tasks 1 2 3 Task Where !</description></item><item><title/><link>https://quartz.jzhao.xyz/Daily/2022-12-26/</link><pubDate>Mon, 01 Jan 0001 00:00:00 +0000</pubDate><guid>https://quartz.jzhao.xyz/Daily/2022-12-26/</guid><description>26-12-22 | Monday In the beginning on my mind 1 List from #onmymind Tasks 1 2 3 Task Where !</description></item><item><title/><link>https://quartz.jzhao.xyz/Daily/2022-12-27/</link><pubDate>Mon, 01 Jan 0001 00:00:00 +0000</pubDate><guid>https://quartz.jzhao.xyz/Daily/2022-12-27/</guid><description>27-12-22 | Tuesday In the beginning on my mind 1 List from #onmymind Tasks 1 2 3 Task Where !</description></item><item><title/><link>https://quartz.jzhao.xyz/Daily/2022-12-28/</link><pubDate>Mon, 01 Jan 0001 00:00:00 +0000</pubDate><guid>https://quartz.jzhao.xyz/Daily/2022-12-28/</guid><description>29-12-22 | Thursday In the beginning on my mind 1 List from #onmymind Tasks 1 2 3 Task Where !</description></item><item><title/><link>https://quartz.jzhao.xyz/Daily/2022-12-29/</link><pubDate>Mon, 01 Jan 0001 00:00:00 +0000</pubDate><guid>https://quartz.jzhao.xyz/Daily/2022-12-29/</guid><description>29-12-22 | Thursday In the beginning on my mind 1 List from #onmymind Tasks 1 2 3 Task Where !</description></item><item><title/><link>https://quartz.jzhao.xyz/Daily/2022-12-30/</link><pubDate>Mon, 01 Jan 0001 00:00:00 +0000</pubDate><guid>https://quartz.jzhao.xyz/Daily/2022-12-30/</guid><description>30-12-22 | Friday In the beginning on my mind 1 List from #onmymind Tasks 1 2 3 Task Where !</description></item><item><title/><link>https://quartz.jzhao.xyz/Daily/2022-12-31/</link><pubDate>Mon, 01 Jan 0001 00:00:00 +0000</pubDate><guid>https://quartz.jzhao.xyz/Daily/2022-12-31/</guid><description>31-12-22 | Saturday In the beginning on my mind 1 List from #onmymind Tasks 1 2 3 Task Where !</description></item><item><title/><link>https://quartz.jzhao.xyz/Daily/2023-01-01/</link><pubDate>Mon, 01 Jan 0001 00:00:00 +0000</pubDate><guid>https://quartz.jzhao.xyz/Daily/2023-01-01/</guid><description>01-01-23 | Sunday In the beginning on my mind 1 List from #onmymind Tasks 1 2 3 Task Where !</description></item><item><title/><link>https://quartz.jzhao.xyz/Daily/2023-01-02/</link><pubDate>Mon, 01 Jan 0001 00:00:00 +0000</pubDate><guid>https://quartz.jzhao.xyz/Daily/2023-01-02/</guid><description>02-01-23 | Monday In the beginning on my mind 1 List from #onmymind Tasks 1 2 3 Task Where !</description></item><item><title/><link>https://quartz.jzhao.xyz/Daily/2023-01-03/</link><pubDate>Mon, 01 Jan 0001 00:00:00 +0000</pubDate><guid>https://quartz.jzhao.xyz/Daily/2023-01-03/</guid><description>03-01-23 | Tuesday In the beginning on my mind 1 List from #onmymind Tasks 1 2 3 Task Where !</description></item><item><title/><link>https://quartz.jzhao.xyz/Daily/2023-01-04/</link><pubDate>Mon, 01 Jan 0001 00:00:00 +0000</pubDate><guid>https://quartz.jzhao.xyz/Daily/2023-01-04/</guid><description>04-01-23 | Wednesday In the beginning on my mind 1 List from #onmymind Tasks 1 2 3 Task Where !</description></item><item><title/><link>https://quartz.jzhao.xyz/Daily/2023-01-05/</link><pubDate>Mon, 01 Jan 0001 00:00:00 +0000</pubDate><guid>https://quartz.jzhao.xyz/Daily/2023-01-05/</guid><description>05-01-23 | Thursday In the beginning on my mind 1 List from #onmymind Tasks 1 2 3 Task Where !</description></item><item><title/><link>https://quartz.jzhao.xyz/Daily/2023-01-06/</link><pubDate>Mon, 01 Jan 0001 00:00:00 +0000</pubDate><guid>https://quartz.jzhao.xyz/Daily/2023-01-06/</guid><description>05-01-23 | Thursday In the beginning on my mind 1 List from #onmymind Tasks 1 2 3 Task Where !</description></item><item><title/><link>https://quartz.jzhao.xyz/Daily/2023-01-07/</link><pubDate>Mon, 01 Jan 0001 00:00:00 +0000</pubDate><guid>https://quartz.jzhao.xyz/Daily/2023-01-07/</guid><description>07-01-23 | Saturday In the beginning on my mind 1 List from #onmymind Tasks 1 2 3 Task Where !</description></item><item><title/><link>https://quartz.jzhao.xyz/Daily/2023-01-08/</link><pubDate>Mon, 01 Jan 0001 00:00:00 +0000</pubDate><guid>https://quartz.jzhao.xyz/Daily/2023-01-08/</guid><description>08-01-23 | Sunday In the beginning on my mind 1 List from #onmymind Tasks 1 2 3 Task Where !</description></item><item><title/><link>https://quartz.jzhao.xyz/Daily/2023-01-09/</link><pubDate>Mon, 01 Jan 0001 00:00:00 +0000</pubDate><guid>https://quartz.jzhao.xyz/Daily/2023-01-09/</guid><description>08-01-23 | Sunday In the beginning on my mind 1 List from #onmymind Tasks 1 2 3 Task Where !</description></item><item><title/><link>https://quartz.jzhao.xyz/Daily/2023-01-10/</link><pubDate>Mon, 01 Jan 0001 00:00:00 +0000</pubDate><guid>https://quartz.jzhao.xyz/Daily/2023-01-10/</guid><description>10-01-23 | Tuesday In the beginning on my mind 1 List from #onmymind Tasks 1 2 3 Task Where !</description></item><item><title/><link>https://quartz.jzhao.xyz/Daily/2023-01-11/</link><pubDate>Mon, 01 Jan 0001 00:00:00 +0000</pubDate><guid>https://quartz.jzhao.xyz/Daily/2023-01-11/</guid><description>11-01-23 | Wednesday In the beginning on my mind 1 List from #onmymind Tasks 1 2 3 Task Where !</description></item><item><title/><link>https://quartz.jzhao.xyz/Daily/2023-01-12/</link><pubDate>Mon, 01 Jan 0001 00:00:00 +0000</pubDate><guid>https://quartz.jzhao.xyz/Daily/2023-01-12/</guid><description>12-01-23 | Wednesday In the beginning on my mind 1 List from #onmymind Tasks 1 2 3 Task Where !</description></item><item><title/><link>https://quartz.jzhao.xyz/Daily/2023-01-13/</link><pubDate>Mon, 01 Jan 0001 00:00:00 +0000</pubDate><guid>https://quartz.jzhao.xyz/Daily/2023-01-13/</guid><description>13-01-23 | Saturday In the beginning on my mind 1 List from #onmymind Tasks 1 2 3 Task Where !</description></item><item><title/><link>https://quartz.jzhao.xyz/Daily/2023-01-14/</link><pubDate>Mon, 01 Jan 0001 00:00:00 +0000</pubDate><guid>https://quartz.jzhao.xyz/Daily/2023-01-14/</guid><description>14-01-23 | Saturday In the beginning on my mind 1 List from #onmymind Tasks 1 2 3 Task Where !</description></item><item><title/><link>https://quartz.jzhao.xyz/Daily/2023-01-15/</link><pubDate>Mon, 01 Jan 0001 00:00:00 +0000</pubDate><guid>https://quartz.jzhao.xyz/Daily/2023-01-15/</guid><description>15-01-23 | Sunday In the beginning on my mind 1 List from #onmymind Tasks 1 2 3 Task Where !</description></item><item><title/><link>https://quartz.jzhao.xyz/Daily/2023-01-16/</link><pubDate>Mon, 01 Jan 0001 00:00:00 +0000</pubDate><guid>https://quartz.jzhao.xyz/Daily/2023-01-16/</guid><description>16-01-23 | Monday In the beginning on my mind 1 List from #onmymind Tasks 1 2 3 Task Where !</description></item><item><title/><link>https://quartz.jzhao.xyz/Daily/2023-01-17/</link><pubDate>Mon, 01 Jan 0001 00:00:00 +0000</pubDate><guid>https://quartz.jzhao.xyz/Daily/2023-01-17/</guid><description>17-01-23 | Tuesday In the beginning on my mind 1 List from #onmymind Tasks 1 2 3 Task Where !</description></item><item><title/><link>https://quartz.jzhao.xyz/Daily/2023-01-18/</link><pubDate>Mon, 01 Jan 0001 00:00:00 +0000</pubDate><guid>https://quartz.jzhao.xyz/Daily/2023-01-18/</guid><description>18-01-23 | Wednesday In the beginning on my mind 1 List from #onmymind Tasks 1 2 3 Task Where !</description></item><item><title/><link>https://quartz.jzhao.xyz/Daily/2023-01-19/</link><pubDate>Mon, 01 Jan 0001 00:00:00 +0000</pubDate><guid>https://quartz.jzhao.xyz/Daily/2023-01-19/</guid><description>19-01-23 | Thursday In the beginning on my mind 1 List from #onmymind Tasks 1 2 3 Task Where !</description></item><item><title/><link>https://quartz.jzhao.xyz/Daily/2023-01-20/</link><pubDate>Mon, 01 Jan 0001 00:00:00 +0000</pubDate><guid>https://quartz.jzhao.xyz/Daily/2023-01-20/</guid><description>23-01-23 | Monday In the beginning on my mind 1 List from #onmymind Tasks 1 2 3 Task Where !</description></item><item><title/><link>https://quartz.jzhao.xyz/Daily/2023-01-21/</link><pubDate>Mon, 01 Jan 0001 00:00:00 +0000</pubDate><guid>https://quartz.jzhao.xyz/Daily/2023-01-21/</guid><description>23-01-23 | Monday In the beginning on my mind 1 List from #onmymind Tasks 1 2 3 Task Where !</description></item><item><title/><link>https://quartz.jzhao.xyz/Daily/2023-01-22/</link><pubDate>Mon, 01 Jan 0001 00:00:00 +0000</pubDate><guid>https://quartz.jzhao.xyz/Daily/2023-01-22/</guid><description>23-01-23 | Monday In the beginning on my mind 1 List from #onmymind Tasks 1 2 3 Task Where !</description></item><item><title/><link>https://quartz.jzhao.xyz/Daily/2023-01-23/</link><pubDate>Mon, 01 Jan 0001 00:00:00 +0000</pubDate><guid>https://quartz.jzhao.xyz/Daily/2023-01-23/</guid><description>23-01-23 | Monday In the beginning on my mind 1 List from #onmymind Tasks 1 2 3 Task Where !</description></item><item><title/><link>https://quartz.jzhao.xyz/Daily/2023-01-24/</link><pubDate>Mon, 01 Jan 0001 00:00:00 +0000</pubDate><guid>https://quartz.jzhao.xyz/Daily/2023-01-24/</guid><description>24-01-23 | Tuesday In the beginning on my mind 1 List from #onmymind Tasks 1 2 3 Task Where !</description></item><item><title/><link>https://quartz.jzhao.xyz/Daily/2023-01-25/</link><pubDate>Mon, 01 Jan 0001 00:00:00 +0000</pubDate><guid>https://quartz.jzhao.xyz/Daily/2023-01-25/</guid><description>24-01-23 | Tuesday In the beginning on my mind 1 List from #onmymind Tasks 1 2 3 Task Where !</description></item><item><title/><link>https://quartz.jzhao.xyz/Daily/2023-01-26/</link><pubDate>Mon, 01 Jan 0001 00:00:00 +0000</pubDate><guid>https://quartz.jzhao.xyz/Daily/2023-01-26/</guid><description>24-01-26 | Tuesday In the beginning on my mind 1 List from #onmymind Tasks 1 2 3 Task Where !</description></item><item><title/><link>https://quartz.jzhao.xyz/Daily/2023-01-27/</link><pubDate>Mon, 01 Jan 0001 00:00:00 +0000</pubDate><guid>https://quartz.jzhao.xyz/Daily/2023-01-27/</guid><description>24-01-27 | Tuesday In the beginning on my mind 1 List from #onmymind Tasks 1 2 3 Task Where !</description></item><item><title/><link>https://quartz.jzhao.xyz/Daily/2023-01-28/</link><pubDate>Mon, 01 Jan 0001 00:00:00 +0000</pubDate><guid>https://quartz.jzhao.xyz/Daily/2023-01-28/</guid><description>28-01-23 | Saturday In the beginning on my mind 1 List from #onmymind Tasks 1 2 3 Task Where !</description></item><item><title/><link>https://quartz.jzhao.xyz/Daily/2023-01-30/</link><pubDate>Mon, 01 Jan 0001 00:00:00 +0000</pubDate><guid>https://quartz.jzhao.xyz/Daily/2023-01-30/</guid><description>30-01-23 | Monday In the beginning on my mind 1 List from #onmymind Tasks 1 2 3 Task Where !</description></item><item><title/><link>https://quartz.jzhao.xyz/Daily/2023-01-31/</link><pubDate>Mon, 01 Jan 0001 00:00:00 +0000</pubDate><guid>https://quartz.jzhao.xyz/Daily/2023-01-31/</guid><description>31-01-23 | Tuesday In the beginning on my mind 1 List from #onmymind Tasks 1 2 3 Task Where !</description></item><item><title/><link>https://quartz.jzhao.xyz/Daily/2023-02-01/</link><pubDate>Mon, 01 Jan 0001 00:00:00 +0000</pubDate><guid>https://quartz.jzhao.xyz/Daily/2023-02-01/</guid><description>01-02-23 | Wednesday In the beginning on my mind 1 List from #onmymind Tasks 1 2 3 Task Where !</description></item><item><title/><link>https://quartz.jzhao.xyz/Daily/2023-02-02/</link><pubDate>Mon, 01 Jan 0001 00:00:00 +0000</pubDate><guid>https://quartz.jzhao.xyz/Daily/2023-02-02/</guid><description>01-02-23 | Wednesday In the beginning on my mind 1 List from #onmymind Tasks 1 2 3 Task Where !</description></item><item><title/><link>https://quartz.jzhao.xyz/Daily/2023-02-03/</link><pubDate>Mon, 01 Jan 0001 00:00:00 +0000</pubDate><guid>https://quartz.jzhao.xyz/Daily/2023-02-03/</guid><description>03-02-23 | Friday In the beginning on my mind 1 List from #onmymind Tasks 1 2 3 Task Where !</description></item><item><title/><link>https://quartz.jzhao.xyz/Daily/2023-02-05/</link><pubDate>Mon, 01 Jan 0001 00:00:00 +0000</pubDate><guid>https://quartz.jzhao.xyz/Daily/2023-02-05/</guid><description>05-02-23 | Sunday Tasks 1 2 3 Task Where !completed Group by file.link 1 2 3 4 5 6 7 8 9 10 11 12 13 14 15 16 17 18 19 20 21 22 23 24 25 26 27 28 29 30 ## Tasks ### Overdue ```tasks not done due before 2023-02-05 ``` ### Due today ```tasks not done due on 2023-02-05 ``` ### Due in the next two weeks ```tasks not done due after 2023-02-05 due before {{date+14d:YYYY-MM-DD}} ``` ### No due date ```tasks not done no due date ``` ### Done today ```tasks done on 2023-02-05 ``` Workspace Food log: Priorities: Resources:</description></item><item><title/><link>https://quartz.jzhao.xyz/Daily/2023-02-06/</link><pubDate>Mon, 01 Jan 0001 00:00:00 +0000</pubDate><guid>https://quartz.jzhao.xyz/Daily/2023-02-06/</guid><description>06-02-23 | Monday Tasks 1 2 3 Task Where !completed Group by file.link 1 2 3 4 5 6 7 8 9 10 11 12 13 14 15 16 17 18 19 20 21 22 23 24 25 26 27 28 29 30 ## Tasks ### Overdue ```tasks not done due before 2023-02-06 ``` ### Due today ```tasks not done due on 2023-02-06 ``` ### Due in the next two weeks ```tasks not done due after 2023-02-06 due before {{date+14d:YYYY-MM-DD}} ``` ### No due date ```tasks not done no due date ``` ### Done today ```tasks done on 2023-02-06 ``` Workspace Food log: Priorities: Resources:</description></item><item><title/><link>https://quartz.jzhao.xyz/Daily/2023-02-09/</link><pubDate>Mon, 01 Jan 0001 00:00:00 +0000</pubDate><guid>https://quartz.jzhao.xyz/Daily/2023-02-09/</guid><description>09-02-23 | Thursday Tasks 1 2 3 Task Where !completed Group by file.link 1 2 3 4 5 6 7 8 9 10 11 12 13 14 15 16 17 18 19 20 21 22 23 24 25 26 27 28 29 30 ## Tasks ### Overdue ```tasks not done due before 2023-02-09 ``` ### Due today ```tasks not done due on 2023-02-09 ``` ### Due in the next two weeks ```tasks not done due after 2023-02-09 due before {{date+14d:YYYY-MM-DD}} ``` ### No due date ```tasks not done no due date ``` ### Done today ```tasks done on 2023-02-09 ``` Workspace Food log: Priorities: Resources:</description></item><item><title/><link>https://quartz.jzhao.xyz/Daily/2023-02-10/</link><pubDate>Mon, 01 Jan 0001 00:00:00 +0000</pubDate><guid>https://quartz.jzhao.xyz/Daily/2023-02-10/</guid><description>10-02-23 | Friday Tasks 1 2 3 Task Where !completed Group by file.link 1 2 3 4 5 6 7 8 9 10 11 12 13 14 15 16 17 18 19 20 21 22 23 24 25 26 27 28 29 30 ## Tasks ### Overdue ```tasks not done due before 2023-02-10 ``` ### Due today ```tasks not done due on 2023-02-10 ``` ### Due in the next two weeks ```tasks not done due after 2023-02-10 due before {{date+14d:YYYY-MM-DD}} ``` ### No due date ```tasks not done no due date ``` ### Done today ```tasks done on 2023-02-10 ``` Workspace Food log: Priorities: Resources:</description></item><item><title/><link>https://quartz.jzhao.xyz/Daily/2023-02-12/</link><pubDate>Mon, 01 Jan 0001 00:00:00 +0000</pubDate><guid>https://quartz.jzhao.xyz/Daily/2023-02-12/</guid><description>12-02-23 | Sunday Tasks 1 2 3 Task Where !completed Group by file.link 1 2 3 4 5 6 7 8 9 10 11 12 13 14 15 16 17 18 19 20 21 22 23 24 25 26 27 28 29 30 ## Tasks ### Overdue ```tasks not done due before 2023-02-12 ``` ### Due today ```tasks not done due on 2023-02-12 ``` ### Due in the next two weeks ```tasks not done due after 2023-02-12 due before {{date+14d:YYYY-MM-DD}} ``` ### No due date ```tasks not done no due date ``` ### Done today ```tasks done on 2023-02-12 ``` Workspace Food log: Priorities: Resources:</description></item><item><title/><link>https://quartz.jzhao.xyz/Daily/2023-02-13/</link><pubDate>Mon, 01 Jan 0001 00:00:00 +0000</pubDate><guid>https://quartz.jzhao.xyz/Daily/2023-02-13/</guid><description>13-02-23 | Monday Tasks 1 2 3 Task Where !completed Group by file.link 1 2 3 4 5 6 7 8 9 10 11 12 13 14 15 16 17 18 19 20 21 22 23 24 25 26 27 28 29 30 ## Tasks ### Overdue ```tasks not done due before 2023-02-13 ``` ### Due today ```tasks not done due on 2023-02-13 ``` ### Due in the next two weeks ```tasks not done due after 2023-02-13 due before {{date+14d:YYYY-MM-DD}} ``` ### No due date ```tasks not done no due date ``` ### Done today ```tasks done on 2023-02-13 ``` Workspace Food log: Priorities: Resources:</description></item><item><title/><link>https://quartz.jzhao.xyz/Daily/2023-02-14/</link><pubDate>Mon, 01 Jan 0001 00:00:00 +0000</pubDate><guid>https://quartz.jzhao.xyz/Daily/2023-02-14/</guid><description>14-02-23 | Tuesday Tasks Overdue 1 2 not done due before 2023-02-14 Due today 1 2 not done due on 2023-02-14 Due in the next two weeks 1 2 3 not done due after 2023-02-14 due before {{date+14d:YYYY-MM-DD}} No due date 1 2 not done no due date Done today 1 done on 2023-02-14 Workspace Food log: Priorities: Resources:</description></item><item><title/><link>https://quartz.jzhao.xyz/Daily/2023-02-15/</link><pubDate>Mon, 01 Jan 0001 00:00:00 +0000</pubDate><guid>https://quartz.jzhao.xyz/Daily/2023-02-15/</guid><description>15-02-23 | Wednesday Tasks Overdue 1 2 not done due before 2023-02-15 Due today 1 2 not done due on 2023-02-15 Due in the next two weeks 1 2 3 not done due after 2023-02-15 due before {{date+14d:YYYY-MM-DD}} No due date 1 2 not done no due date Done today 1 done on 2023-02-15 Workspace Food log: Priorities: Resources: ⏫ - [ ] Galope Design presentation 🛫 2023-02-15 📅 2023-02-19</description></item><item><title/><link>https://quartz.jzhao.xyz/Daily/2023-02-16/</link><pubDate>Mon, 01 Jan 0001 00:00:00 +0000</pubDate><guid>https://quartz.jzhao.xyz/Daily/2023-02-16/</guid><description>16-02-23 | Thursday Tasks Overdue 1 2 not done due before 2023-02-16 Due today 1 2 not done due on 2023-02-16 Due in the next two weeks 1 2 3 not done due after 2023-02-16 due before {{date+14d:YYYY-MM-DD}} No due date 1 2 not done no due date Done today 1 done on 2023-02-16 Workspace Food log: Priorities: Resources:</description></item><item><title/><link>https://quartz.jzhao.xyz/Daily/2023-02-17/</link><pubDate>Mon, 01 Jan 0001 00:00:00 +0000</pubDate><guid>https://quartz.jzhao.xyz/Daily/2023-02-17/</guid><description>17-02-23 | Friday Tasks Overdue 1 2 not done due before 2023-02-17 Due today 1 2 not done due on 2023-02-17 Due in the next two weeks 1 2 3 not done due after 2023-02-17 due before {{date+14d:YYYY-MM-DD}} No due date 1 2 not done no due date Done today 1 done on 2023-02-17 Workspace Food log: Priorities: Resources:</description></item><item><title/><link>https://quartz.jzhao.xyz/Daily/2023-02-18/</link><pubDate>Mon, 01 Jan 0001 00:00:00 +0000</pubDate><guid>https://quartz.jzhao.xyz/Daily/2023-02-18/</guid><description>18-02-23 | Saturday Tasks Overdue 1 2 not done due before 2023-02-18 Due today 1 2 not done due on 2023-02-18 Due in the next two weeks 1 2 3 not done due after 2023-02-18 due before {{date+14d:YYYY-MM-DD}} No due date 1 2 not done no due date Done today 1 done on 2023-02-18 Workspace Food log: Priorities: Resources:</description></item><item><title/><link>https://quartz.jzhao.xyz/Daily/2023-02-21/</link><pubDate>Mon, 01 Jan 0001 00:00:00 +0000</pubDate><guid>https://quartz.jzhao.xyz/Daily/2023-02-21/</guid><description>21-02-23 | Tuesday Tasks Overdue 1 2 not done due before 2023-02-21 Due today 1 2 not done due on 2023-02-21 Due in the next two weeks 1 2 3 not done due after 2023-02-21 due before {{date+14d:YYYY-MM-DD}} No due date 1 2 not done no due date Done today 1 done on 2023-02-21 Workspace Food log: Priorities: Resources:</description></item><item><title/><link>https://quartz.jzhao.xyz/Daily/2023-02-22/</link><pubDate>Mon, 01 Jan 0001 00:00:00 +0000</pubDate><guid>https://quartz.jzhao.xyz/Daily/2023-02-22/</guid><description>22-02-23 | Wednesday Tasks Overdue 1 2 not done due before 2023-02-22 Due today 1 2 not done due on 2023-02-22 Due in the next two weeks 1 2 3 not done due after 2023-02-22 due before {{date+14d:YYYY-MM-DD}} No due date 1 2 not done no due date Done today 1 done on 2023-02-22 Workspace Food log: Priorities: Resources:</description></item><item><title/><link>https://quartz.jzhao.xyz/Daily/2023-02-23/</link><pubDate>Mon, 01 Jan 0001 00:00:00 +0000</pubDate><guid>https://quartz.jzhao.xyz/Daily/2023-02-23/</guid><description>23-02-23 | Thursday Tasks Overdue 1 2 not done due before 2023-02-23 Due today 1 2 not done due on 2023-02-23 Due in the next two weeks 1 2 3 not done due after 2023-02-23 due before {{date+14d:YYYY-MM-DD}} No due date 1 2 not done no due date Done today 1 done on 2023-02-23 Workspace Food log: Priorities: Resources:</description></item><item><title/><link>https://quartz.jzhao.xyz/Daily/2023-02-24/</link><pubDate>Mon, 01 Jan 0001 00:00:00 +0000</pubDate><guid>https://quartz.jzhao.xyz/Daily/2023-02-24/</guid><description>24-02-23 | Friday Tasks Overdue 1 2 not done due before 2023-02-24 Due today 1 2 not done due on 2023-02-24 Due in the next two weeks 1 2 3 not done due after 2023-02-24 due before {{date+14d:YYYY-MM-DD}} No due date 1 2 not done no due date Done today 1 done on 2023-02-24 Workspace Food log: Priorities: Resources:</description></item><item><title/><link>https://quartz.jzhao.xyz/Daily/2023-02-25/</link><pubDate>Mon, 01 Jan 0001 00:00:00 +0000</pubDate><guid>https://quartz.jzhao.xyz/Daily/2023-02-25/</guid><description>25-02-23 | Saturday Tasks Overdue 1 2 not done due before 2023-02-25 Due today 1 2 not done due on 2023-02-25 Due in the next two weeks 1 2 3 not done due after 2023-02-25 due before {{date+14d:YYYY-MM-DD}} No due date 1 2 not done no due date Done today 1 done on 2023-02-25 Workspace Food log: Priorities: Resources:</description></item><item><title/><link>https://quartz.jzhao.xyz/Daily/2023-02-26/</link><pubDate>Mon, 01 Jan 0001 00:00:00 +0000</pubDate><guid>https://quartz.jzhao.xyz/Daily/2023-02-26/</guid><description>26-02-23 | Sunday Tasks Overdue 1 2 not done due before 2023-02-26 Due today 1 2 not done due on 2023-02-26 Due in the next two weeks 1 2 3 not done due after 2023-02-26 due before {{date+14d:YYYY-MM-DD}} No due date 1 2 not done no due date Done today 1 done on 2023-02-26 Workspace Food log: Priorities: Resources:</description></item><item><title/><link>https://quartz.jzhao.xyz/Daily/2023-02-28/</link><pubDate>Mon, 01 Jan 0001 00:00:00 +0000</pubDate><guid>https://quartz.jzhao.xyz/Daily/2023-02-28/</guid><description>28-02-23 | Tuesday Tasks Overdue 1 2 not done due before 2023-02-28 Due today 1 2 not done due on 2023-02-28 Due in the next two weeks 1 2 3 not done due after 2023-02-28 due before {{date+14d:YYYY-MM-DD}} No due date 1 2 not done no due date Done today 1 done on 2023-02-28 Workspace Food log: Priorities: Resources:</description></item><item><title/><link>https://quartz.jzhao.xyz/Daily/2023-03-02/</link><pubDate>Mon, 01 Jan 0001 00:00:00 +0000</pubDate><guid>https://quartz.jzhao.xyz/Daily/2023-03-02/</guid><description>02-03-23 | Thursday Tasks Overdue 1 2 not done due before 2023-03-02 Due today 1 2 not done due on 2023-03-02 Due in the next two weeks 1 2 3 not done due after 2023-03-02 due before {{date+14d:YYYY-MM-DD}} No due date 1 2 not done no due date Done today 1 done on 2023-03-02 Workspace Food log: Priorities: Resources:</description></item><item><title/><link>https://quartz.jzhao.xyz/Daily/2023-03-03/</link><pubDate>Mon, 01 Jan 0001 00:00:00 +0000</pubDate><guid>https://quartz.jzhao.xyz/Daily/2023-03-03/</guid><description>03-03-23 | Friday Tasks Overdue 1 2 not done due before 2023-03-03 Due today 1 2 not done due on 2023-03-03 Due in the next two weeks 1 2 3 not done due after 2023-03-03 due before {{date+14d:YYYY-MM-DD}} No due date 1 2 not done no due date Done today 1 done on 2023-03-03 Workspace Food log: Priorities: Resources:</description></item><item><title/><link>https://quartz.jzhao.xyz/Daily/2023-03-04/</link><pubDate>Mon, 01 Jan 0001 00:00:00 +0000</pubDate><guid>https://quartz.jzhao.xyz/Daily/2023-03-04/</guid><description>04-03-23 | Saturday Tasks Overdue 1 2 not done due before 2023-03-04 Due today 1 2 not done due on 2023-03-04 Due in the next two weeks 1 2 3 not done due after 2023-03-04 due before {{date+14d:YYYY-MM-DD}} No due date 1 2 not done no due date Done today 1 done on 2023-03-04 Workspace Food log: Priorities: Resources:</description></item><item><title/><link>https://quartz.jzhao.xyz/Daily/2023-03-05/</link><pubDate>Mon, 01 Jan 0001 00:00:00 +0000</pubDate><guid>https://quartz.jzhao.xyz/Daily/2023-03-05/</guid><description>05-03-23 | Sunday Tasks Overdue 1 2 not done due before 2023-03-05 Due today 1 2 not done due on 2023-03-05 Due in the next two weeks 1 2 3 not done due after 2023-03-05 due before {{date+14d:YYYY-MM-DD}} No due date 1 2 not done no due date Done today 1 done on 2023-03-05 Workspace Food log: Priorities: Resources:</description></item><item><title/><link>https://quartz.jzhao.xyz/Daily/2023-03-06/</link><pubDate>Mon, 01 Jan 0001 00:00:00 +0000</pubDate><guid>https://quartz.jzhao.xyz/Daily/2023-03-06/</guid><description>06-03-23 | Monday Tasks Overdue 1 2 not done due before 2023-03-06 Due today 1 2 not done due on 2023-03-06 Due in the next two weeks 1 2 3 not done due after 2023-03-06 due before {{date+14d:YYYY-MM-DD}} No due date 1 2 not done no due date Done today 1 done on 2023-03-06 Workspace Food log: Priorities: Resources: https://josephsacco.</description></item><item><title/><link>https://quartz.jzhao.xyz/Daily/2023-03-07/</link><pubDate>Mon, 01 Jan 0001 00:00:00 +0000</pubDate><guid>https://quartz.jzhao.xyz/Daily/2023-03-07/</guid><description>07-03-23 | Tuesday Tasks Overdue 1 2 not done due before 2023-03-07 Due today 1 2 not done due on 2023-03-07 Due in the next two weeks 1 2 3 not done due after 2023-03-07 due before {{date+14d:YYYY-MM-DD}} No due date 1 2 not done no due date Done today 1 done on 2023-03-07 Workspace Food log: Priorities: Resources:</description></item><item><title/><link>https://quartz.jzhao.xyz/Daily/2023-03-08/</link><pubDate>Mon, 01 Jan 0001 00:00:00 +0000</pubDate><guid>https://quartz.jzhao.xyz/Daily/2023-03-08/</guid><description>08-03-23 | Wednesday Tasks Overdue 1 2 not done due before 2023-03-08 Due today 1 2 not done due on 2023-03-08 Due in the next two weeks 1 2 3 not done due after 2023-03-08 due before {{date+14d:YYYY-MM-DD}} No due date 1 2 not done no due date Done today 1 done on 2023-03-08 Workspace Food log: Priorities: Resources:</description></item><item><title/><link>https://quartz.jzhao.xyz/Daily/2023-03-09/</link><pubDate>Mon, 01 Jan 0001 00:00:00 +0000</pubDate><guid>https://quartz.jzhao.xyz/Daily/2023-03-09/</guid><description>09-03-23 | Thursday Tasks Overdue 1 2 not done due before 2023-03-09 Due today 1 2 not done due on 2023-03-09 Due in the next two weeks 1 2 3 not done due after 2023-03-09 due before {{date+14d:YYYY-MM-DD}} No due date 1 2 not done no due date Done today 1 done on 2023-03-09 Workspace Food log: Priorities: Resources:</description></item><item><title/><link>https://quartz.jzhao.xyz/Daily/2023-03-10/</link><pubDate>Mon, 01 Jan 0001 00:00:00 +0000</pubDate><guid>https://quartz.jzhao.xyz/Daily/2023-03-10/</guid><description>10-03-23 | Friday Tasks Overdue 1 2 not done due before 2023-03-10 Due today 1 2 not done due on 2023-03-10 Due in the next two weeks 1 2 3 not done due after 2023-03-10 due before {{date+14d:YYYY-MM-DD}} No due date 1 2 not done no due date Done today 1 done on 2023-03-10 Workspace Food log: Priorities: Resources:</description></item><item><title/><link>https://quartz.jzhao.xyz/Daily/2023-03-13/</link><pubDate>Mon, 01 Jan 0001 00:00:00 +0000</pubDate><guid>https://quartz.jzhao.xyz/Daily/2023-03-13/</guid><description>13-03-23 | Monday Tasks Overdue 1 2 not done due before 2023-03-13 Due today 1 2 not done due on 2023-03-13 Due in the next two weeks 1 2 3 not done due after 2023-03-13 due before {{date+14d:YYYY-MM-DD}} No due date 1 2 not done no due date Done today 1 done on 2023-03-13 Workspace Food log: Priorities: Resources:</description></item><item><title/><link>https://quartz.jzhao.xyz/Daily/2023-03-19/</link><pubDate>Mon, 01 Jan 0001 00:00:00 +0000</pubDate><guid>https://quartz.jzhao.xyz/Daily/2023-03-19/</guid><description>19-03-23 | Sunday Tasks Overdue 1 2 not done due before 2023-03-19 Due today 1 2 not done due on 2023-03-19 Due in the next two weeks 1 2 3 not done due after 2023-03-19 due before {{date+14d:YYYY-MM-DD}} No due date 1 2 not done no due date Done today 1 done on 2023-03-19 Workspace Meditation</description></item><item><title/><link>https://quartz.jzhao.xyz/Daily/2023-03-23/</link><pubDate>Mon, 01 Jan 0001 00:00:00 +0000</pubDate><guid>https://quartz.jzhao.xyz/Daily/2023-03-23/</guid><description>23-03-23 | Thursday Tasks Overdue 1 2 not done due before 2023-03-23 Due today 1 2 not done due on 2023-03-23 Due in the next two weeks 1 2 3 not done due after 2023-03-23 due before {{date+14d:YYYY-MM-DD}} No due date 1 2 not done no due date Done today 1 done on 2023-03-23 Workspace Meditation</description></item><item><title/><link>https://quartz.jzhao.xyz/Daily/2023-03-24/</link><pubDate>Mon, 01 Jan 0001 00:00:00 +0000</pubDate><guid>https://quartz.jzhao.xyz/Daily/2023-03-24/</guid><description>24-03-23 | Friday Tasks Overdue 1 2 not done due before 2023-03-24 Due today 1 2 not done due on 2023-03-24 Due in the next two weeks 1 2 3 not done due after 2023-03-24 due before {{date+14d:YYYY-MM-DD}} No due date 1 2 not done no due date Done today 1 done on 2023-03-24 Workspace Meditation</description></item><item><title/><link>https://quartz.jzhao.xyz/Daily/2023-03-27/</link><pubDate>Mon, 01 Jan 0001 00:00:00 +0000</pubDate><guid>https://quartz.jzhao.xyz/Daily/2023-03-27/</guid><description>27-03-23 | Monday Tasks Overdue 1 2 not done due before 2023-03-27 Due today 1 2 not done due on 2023-03-27 Due in the next two weeks 1 2 3 not done due after 2023-03-27 due before {{date+14d:YYYY-MM-DD}} No due date 1 2 not done no due date Done today 1 done on 2023-03-27 Workspace Meditation</description></item><item><title/><link>https://quartz.jzhao.xyz/Daily/2023-03-31/</link><pubDate>Mon, 01 Jan 0001 00:00:00 +0000</pubDate><guid>https://quartz.jzhao.xyz/Daily/2023-03-31/</guid><description>31-03-23 | Friday Tasks Overdue 1 2 not done due before 2023-03-31 Due today 1 2 not done due on 2023-03-31 Due in the next two weeks 1 2 3 not done due after 2023-03-31 due before {{date+14d:YYYY-MM-DD}} No due date 1 2 not done no due date Done today 1 done on 2023-03-31 Workspace Meditation</description></item><item><title/><link>https://quartz.jzhao.xyz/Daily/2023-04-01/</link><pubDate>Mon, 01 Jan 0001 00:00:00 +0000</pubDate><guid>https://quartz.jzhao.xyz/Daily/2023-04-01/</guid><description>01-04-23 | Saturday Tasks Overdue 1 2 not done due before 2023-04-01 Due today 1 2 not done due on 2023-04-01 Due in the next two weeks 1 2 3 not done due after 2023-04-01 due before {{date+14d:YYYY-MM-DD}} No due date 1 2 not done no due date Done today 1 done on 2023-04-01 Workspace Meditation</description></item><item><title/><link>https://quartz.jzhao.xyz/Daily/2023-04-03/</link><pubDate>Mon, 01 Jan 0001 00:00:00 +0000</pubDate><guid>https://quartz.jzhao.xyz/Daily/2023-04-03/</guid><description>03-04-23 | Monday Tasks Overdue 1 2 not done due before 2023-04-03 Due today 1 2 not done due on 2023-04-03 Due in the next two weeks 1 2 3 not done due after 2023-04-03 due before {{date+14d:YYYY-MM-DD}} No due date 1 2 not done no due date Done today 1 done on 2023-04-03 Workspace Meditation</description></item><item><title/><link>https://quartz.jzhao.xyz/Daily/2023-04-04/</link><pubDate>Mon, 01 Jan 0001 00:00:00 +0000</pubDate><guid>https://quartz.jzhao.xyz/Daily/2023-04-04/</guid><description>04-04-23 | Tuesday Tasks Overdue 1 2 not done due before 2023-04-04 Due today 1 2 not done due on 2023-04-04 Due in the next two weeks 1 2 3 not done due after 2023-04-04 due before {{date+14d:YYYY-MM-DD}} No due date 1 2 not done no due date Done today 1 done on 2023-04-04 Workspace Meditation</description></item><item><title/><link>https://quartz.jzhao.xyz/Daily/2023-04-07/</link><pubDate>Mon, 01 Jan 0001 00:00:00 +0000</pubDate><guid>https://quartz.jzhao.xyz/Daily/2023-04-07/</guid><description>07-04-23 | Friday Tasks Overdue 1 2 not done due before 2023-04-07 Due today 1 2 not done due on 2023-04-07 Due in the next two weeks 1 2 3 not done due after 2023-04-07 due before {{date+14d:YYYY-MM-DD}} No due date 1 2 not done no due date Done today 1 done on 2023-04-07 Workspace Meditation</description></item><item><title/><link>https://quartz.jzhao.xyz/Daily/2023-04-08/</link><pubDate>Mon, 01 Jan 0001 00:00:00 +0000</pubDate><guid>https://quartz.jzhao.xyz/Daily/2023-04-08/</guid><description>08-04-23 | Saturday Tasks Overdue 1 2 not done due before 2023-04-08 Due today 1 2 not done due on 2023-04-08 Due in the next two weeks 1 2 3 not done due after 2023-04-08 due before {{date+14d:YYYY-MM-DD}} No due date 1 2 not done no due date Done today 1 done on 2023-04-08 Workspace Meditation</description></item><item><title/><link>https://quartz.jzhao.xyz/Daily/2023-04-09/</link><pubDate>Mon, 01 Jan 0001 00:00:00 +0000</pubDate><guid>https://quartz.jzhao.xyz/Daily/2023-04-09/</guid><description>09-04-23 | Sunday Tasks Overdue 1 2 not done due before 2023-04-09 Due today 1 2 not done due on 2023-04-09 Due in the next two weeks 1 2 3 not done due after 2023-04-09 due before {{date+14d:YYYY-MM-DD}} No due date 1 2 not done no due date Done today 1 done on 2023-04-09 Workspace Meditation</description></item><item><title/><link>https://quartz.jzhao.xyz/Daily/2023-04-11/</link><pubDate>Mon, 01 Jan 0001 00:00:00 +0000</pubDate><guid>https://quartz.jzhao.xyz/Daily/2023-04-11/</guid><description>11-04-23 | Tuesday Tasks Overdue 1 2 not done due before 2023-04-11 Due today 1 2 not done due on 2023-04-11 Due in the next two weeks 1 2 3 not done due after 2023-04-11 due before {{date+14d:YYYY-MM-DD}} No due date 1 2 not done no due date Done today 1 done on 2023-04-11 Workspace Meditation</description></item><item><title/><link>https://quartz.jzhao.xyz/Daily/2023-04-13/</link><pubDate>Mon, 01 Jan 0001 00:00:00 +0000</pubDate><guid>https://quartz.jzhao.xyz/Daily/2023-04-13/</guid><description>13-04-23 | Thursday Tasks Overdue 1 2 not done due before 2023-04-13 Due today 1 2 not done due on 2023-04-13 Due in the next two weeks 1 2 3 not done due after 2023-04-13 due before {{date+14d:YYYY-MM-DD}} No due date 1 2 not done no due date Done today 1 done on 2023-04-13 Workspace Meditation</description></item><item><title/><link>https://quartz.jzhao.xyz/Daily/2023-04-16/</link><pubDate>Mon, 01 Jan 0001 00:00:00 +0000</pubDate><guid>https://quartz.jzhao.xyz/Daily/2023-04-16/</guid><description>16-04-23 | Sunday Tasks Overdue 1 2 not done due before 2023-04-16 Due today 1 2 not done due on 2023-04-16 Due in the next two weeks 1 2 3 not done due after 2023-04-16 due before {{date+14d:YYYY-MM-DD}} No due date 1 2 not done no due date Done today 1 done on 2023-04-16 Workspace Meditation</description></item><item><title/><link>https://quartz.jzhao.xyz/Daily/2023-04-18/</link><pubDate>Mon, 01 Jan 0001 00:00:00 +0000</pubDate><guid>https://quartz.jzhao.xyz/Daily/2023-04-18/</guid><description>18-04-23 | Tuesday Tasks Overdue 1 2 not done due before 2023-04-18 Due today 1 2 not done due on 2023-04-18 Due in the next two weeks 1 2 3 not done due after 2023-04-18 due before {{date+14d:YYYY-MM-DD}} No due date 1 2 not done no due date Done today 1 done on 2023-04-18 Workspace Meditation</description></item><item><title/><link>https://quartz.jzhao.xyz/Daily/2023-04-20/</link><pubDate>Mon, 01 Jan 0001 00:00:00 +0000</pubDate><guid>https://quartz.jzhao.xyz/Daily/2023-04-20/</guid><description>20-04-23 | Thursday Tasks Overdue 1 2 not done due before 2023-04-20 Due today 1 2 not done due on 2023-04-20 Due in the next two weeks 1 2 3 not done due after 2023-04-20 due before {{date+14d:YYYY-MM-DD}} No due date 1 2 not done no due date Done today 1 done on 2023-04-20 Workspace Meditation</description></item><item><title/><link>https://quartz.jzhao.xyz/Daily/2023-04-21/</link><pubDate>Mon, 01 Jan 0001 00:00:00 +0000</pubDate><guid>https://quartz.jzhao.xyz/Daily/2023-04-21/</guid><description>21-04-23 | Friday Tasks Overdue 1 2 not done due before 2023-04-21 Due today 1 2 not done due on 2023-04-21 Due in the next two weeks 1 2 3 not done due after 2023-04-21 due before {{date+14d:YYYY-MM-DD}} No due date 1 2 not done no due date Done today 1 done on 2023-04-21 Workspace Meditation</description></item><item><title/><link>https://quartz.jzhao.xyz/Daily/2023-04-22/</link><pubDate>Mon, 01 Jan 0001 00:00:00 +0000</pubDate><guid>https://quartz.jzhao.xyz/Daily/2023-04-22/</guid><description>22-04-23 | Saturday Tasks Overdue 1 2 not done due before 2023-04-22 Due today 1 2 not done due on 2023-04-22 Due in the next two weeks 1 2 3 not done due after 2023-04-22 due before {{date+14d:YYYY-MM-DD}} No due date 1 2 not done no due date Done today 1 done on 2023-04-22 Workspace Meditation</description></item><item><title/><link>https://quartz.jzhao.xyz/Daily/2023-04-28/</link><pubDate>Mon, 01 Jan 0001 00:00:00 +0000</pubDate><guid>https://quartz.jzhao.xyz/Daily/2023-04-28/</guid><description>28-04-23 | Friday Tasks Overdue 1 2 not done due before 2023-04-28 Due today 1 2 not done due on 2023-04-28 Due in the next two weeks 1 2 3 not done due after 2023-04-28 due before {{date+14d:YYYY-MM-DD}} No due date 1 2 not done no due date Done today 1 done on 2023-04-28 Workspace Meditation</description></item><item><title/><link>https://quartz.jzhao.xyz/Daily/2023-04-29/</link><pubDate>Mon, 01 Jan 0001 00:00:00 +0000</pubDate><guid>https://quartz.jzhao.xyz/Daily/2023-04-29/</guid><description>29-04-23 | Saturday Tasks Overdue 1 2 not done due before 2023-04-29 Due today 1 2 not done due on 2023-04-29 Due in the next two weeks 1 2 3 not done due after 2023-04-29 due before {{date+14d:YYYY-MM-DD}} No due date 1 2 not done no due date Done today 1 done on 2023-04-29 Workspace Meditation</description></item><item><title/><link>https://quartz.jzhao.xyz/Daily/2023-05-04/</link><pubDate>Mon, 01 Jan 0001 00:00:00 +0000</pubDate><guid>https://quartz.jzhao.xyz/Daily/2023-05-04/</guid><description>04-05-23 | Thursday Tasks Overdue 1 2 not done due before 2023-05-04 Due today 1 2 not done due on 2023-05-04 Due in the next two weeks 1 2 3 not done due after 2023-05-04 due before {{date+14d:YYYY-MM-DD}} No due date 1 2 not done no due date Done today 1 done on 2023-05-04 Workspace Meditation</description></item><item><title/><link>https://quartz.jzhao.xyz/Daily/2023-05-13/</link><pubDate>Mon, 01 Jan 0001 00:00:00 +0000</pubDate><guid>https://quartz.jzhao.xyz/Daily/2023-05-13/</guid><description>13-05-23 | Saturday Tasks Overdue 1 2 not done due before 2023-05-13 Due today 1 2 not done due on 2023-05-13 Due in the next two weeks 1 2 3 not done due after 2023-05-13 due before {{date+14d:YYYY-MM-DD}} No due date 1 2 not done no due date Done today 1 done on 2023-05-13 Workspace Meditation</description></item><item><title/><link>https://quartz.jzhao.xyz/Daily/2023-05-14/</link><pubDate>Mon, 01 Jan 0001 00:00:00 +0000</pubDate><guid>https://quartz.jzhao.xyz/Daily/2023-05-14/</guid><description>14-05-23 | Sunday Tasks Overdue 1 2 not done due before 2023-05-14 Due today 1 2 not done due on 2023-05-14 Due in the next two weeks 1 2 3 not done due after 2023-05-14 due before {{date+14d:YYYY-MM-DD}} No due date 1 2 not done no due date Done today 1 done on 2023-05-14 Workspace Meditation</description></item><item><title/><link>https://quartz.jzhao.xyz/Daily/2023-05-16/</link><pubDate>Mon, 01 Jan 0001 00:00:00 +0000</pubDate><guid>https://quartz.jzhao.xyz/Daily/2023-05-16/</guid><description>16-05-23 | Tuesday Tasks Overdue 1 2 not done due before 2023-05-16 Due today 1 2 not done due on 2023-05-16 Due in the next two weeks 1 2 3 not done due after 2023-05-16 due before {{date+14d:YYYY-MM-DD}} No due date 1 2 not done no due date Done today 1 done on 2023-05-16 Workspace Meditation</description></item><item><title/><link>https://quartz.jzhao.xyz/Daily/2023-05-18/</link><pubDate>Mon, 01 Jan 0001 00:00:00 +0000</pubDate><guid>https://quartz.jzhao.xyz/Daily/2023-05-18/</guid><description>18-05-23 | Thursday Tasks Overdue 1 2 not done due before 2023-05-18 Due today 1 2 not done due on 2023-05-18 Due in the next two weeks 1 2 3 not done due after 2023-05-18 due before {{date+14d:YYYY-MM-DD}} No due date 1 2 not done no due date Done today 1 done on 2023-05-18 Workspace Meditation</description></item><item><title/><link>https://quartz.jzhao.xyz/Daily/2023-05-19/</link><pubDate>Mon, 01 Jan 0001 00:00:00 +0000</pubDate><guid>https://quartz.jzhao.xyz/Daily/2023-05-19/</guid><description>19-05-23 | Friday Tasks Overdue 1 2 not done due before 2023-05-19 Due today 1 2 not done due on 2023-05-19 Due in the next two weeks 1 2 3 not done due after 2023-05-19 due before {{date+14d:YYYY-MM-DD}} No due date 1 2 not done no due date Done today 1 done on 2023-05-19 Workspace Meditation</description></item><item><title/><link>https://quartz.jzhao.xyz/Daily/2023-05-20/</link><pubDate>Mon, 01 Jan 0001 00:00:00 +0000</pubDate><guid>https://quartz.jzhao.xyz/Daily/2023-05-20/</guid><description>20-05-23 | Saturday Tasks Overdue 1 2 not done due before 2023-05-20 Due today 1 2 not done due on 2023-05-20 Due in the next two weeks 1 2 3 not done due after 2023-05-20 due before {{date+14d:YYYY-MM-DD}} No due date 1 2 not done no due date Done today 1 done on 2023-05-20 Workspace Meditation</description></item><item><title/><link>https://quartz.jzhao.xyz/Daily/2023-05-21/</link><pubDate>Mon, 01 Jan 0001 00:00:00 +0000</pubDate><guid>https://quartz.jzhao.xyz/Daily/2023-05-21/</guid><description>21-05-23 | Sunday Tasks Overdue 1 2 not done due before 2023-05-21 Due today 1 2 not done due on 2023-05-21 Due in the next two weeks 1 2 3 not done due after 2023-05-21 due before {{date+14d:YYYY-MM-DD}} No due date 1 2 not done no due date Done today 1 done on 2023-05-21 Workspace Meditation</description></item><item><title/><link>https://quartz.jzhao.xyz/Daily/2023-05-24/</link><pubDate>Mon, 01 Jan 0001 00:00:00 +0000</pubDate><guid>https://quartz.jzhao.xyz/Daily/2023-05-24/</guid><description>24-05-23 | Wednesday Tasks Overdue 1 2 not done due before 2023-05-24 Due today 1 2 not done due on 2023-05-24 Due in the next two weeks 1 2 3 not done due after 2023-05-24 due before {{date+14d:YYYY-MM-DD}} No due date 1 2 not done no due date Done today 1 done on 2023-05-24 Workspace Meditation</description></item><item><title/><link>https://quartz.jzhao.xyz/Daily/2023-05-25/</link><pubDate>Mon, 01 Jan 0001 00:00:00 +0000</pubDate><guid>https://quartz.jzhao.xyz/Daily/2023-05-25/</guid><description>25-05-23 | Thursday Tasks Overdue 1 2 not done due before 2023-05-25 Due today 1 2 not done due on 2023-05-25 Due in the next two weeks 1 2 3 not done due after 2023-05-25 due before {{date+14d:YYYY-MM-DD}} No due date 1 2 not done no due date Done today 1 done on 2023-05-25 Workspace Meditation</description></item><item><title/><link>https://quartz.jzhao.xyz/Daily/2023-05-26/</link><pubDate>Mon, 01 Jan 0001 00:00:00 +0000</pubDate><guid>https://quartz.jzhao.xyz/Daily/2023-05-26/</guid><description>26-05-23 | Friday Tasks Overdue 1 2 not done due before 2023-05-26 Due today 1 2 not done due on 2023-05-26 Due in the next two weeks 1 2 3 not done due after 2023-05-26 due before {{date+14d:YYYY-MM-DD}} No due date 1 2 not done no due date Done today 1 done on 2023-05-26 Workspace Meditation</description></item><item><title/><link>https://quartz.jzhao.xyz/Daily/2023-05-29/</link><pubDate>Mon, 01 Jan 0001 00:00:00 +0000</pubDate><guid>https://quartz.jzhao.xyz/Daily/2023-05-29/</guid><description>29-05-23 | Monday Tasks Overdue 1 2 not done due before 2023-05-29 Due today 1 2 not done due on 2023-05-29 Due in the next two weeks 1 2 3 not done due after 2023-05-29 due before {{date+14d:YYYY-MM-DD}} No due date 1 2 not done no due date Done today 1 done on 2023-05-29 Workspace Meditation</description></item><item><title/><link>https://quartz.jzhao.xyz/Daily/2023-05-30/</link><pubDate>Mon, 01 Jan 0001 00:00:00 +0000</pubDate><guid>https://quartz.jzhao.xyz/Daily/2023-05-30/</guid><description>30-05-23 | Tuesday Tasks Overdue 1 2 not done due before 2023-05-30 Due today 1 2 not done due on 2023-05-30 Due in the next two weeks 1 2 3 not done due after 2023-05-30 due before {{date+14d:YYYY-MM-DD}} No due date 1 2 not done no due date Done today 1 done on 2023-05-30 Workspace Meditation</description></item><item><title/><link>https://quartz.jzhao.xyz/Daily/2023-06-05/</link><pubDate>Mon, 01 Jan 0001 00:00:00 +0000</pubDate><guid>https://quartz.jzhao.xyz/Daily/2023-06-05/</guid><description>05-06-23 | Monday Tasks Overdue 1 2 not done due before 2023-06-05 Due today 1 2 not done due on 2023-06-05 Due in the next two weeks 1 2 3 not done due after 2023-06-05 due before {{date+14d:YYYY-MM-DD}} No due date 1 2 not done no due date Done today 1 done on 2023-06-05 Workspace Meditation</description></item><item><title/><link>https://quartz.jzhao.xyz/Daily/2023-06-06/</link><pubDate>Mon, 01 Jan 0001 00:00:00 +0000</pubDate><guid>https://quartz.jzhao.xyz/Daily/2023-06-06/</guid><description>06-06-23 | Tuesday Tasks Overdue 1 2 not done due before 2023-06-06 Due today 1 2 not done due on 2023-06-06 Due in the next two weeks 1 2 3 not done due after 2023-06-06 due before {{date+14d:YYYY-MM-DD}} No due date 1 2 not done no due date Done today 1 done on 2023-06-06 Workspace Meditation</description></item><item><title/><link>https://quartz.jzhao.xyz/Daily/2023-06-07/</link><pubDate>Mon, 01 Jan 0001 00:00:00 +0000</pubDate><guid>https://quartz.jzhao.xyz/Daily/2023-06-07/</guid><description>07-06-23 | Wednesday Tasks Overdue 1 2 not done due before 2023-06-07 Due today 1 2 not done due on 2023-06-07 Due in the next two weeks 1 2 3 not done due after 2023-06-07 due before {{date+14d:YYYY-MM-DD}} No due date 1 2 not done no due date Done today 1 done on 2023-06-07 Workspace Meditation</description></item><item><title/><link>https://quartz.jzhao.xyz/Daily/2023-06-08/</link><pubDate>Mon, 01 Jan 0001 00:00:00 +0000</pubDate><guid>https://quartz.jzhao.xyz/Daily/2023-06-08/</guid><description>08-06-23 | Thursday Tasks Overdue 1 2 not done due before 2023-06-08 Due today 1 2 not done due on 2023-06-08 Due in the next two weeks 1 2 3 not done due after 2023-06-08 due before {{date+14d:YYYY-MM-DD}} No due date 1 2 not done no due date Done today 1 done on 2023-06-08 Workspace Meditation</description></item><item><title/><link>https://quartz.jzhao.xyz/Daily/2023-06-09/</link><pubDate>Mon, 01 Jan 0001 00:00:00 +0000</pubDate><guid>https://quartz.jzhao.xyz/Daily/2023-06-09/</guid><description>09-06-23 | Friday Tasks Overdue 1 2 not done due before 2023-06-09 Due today 1 2 not done due on 2023-06-09 Due in the next two weeks 1 2 3 not done due after 2023-06-09 due before {{date+14d:YYYY-MM-DD}} No due date 1 2 not done no due date Done today 1 done on 2023-06-09 Workspace Meditation</description></item><item><title/><link>https://quartz.jzhao.xyz/Daily/2023-06-10/</link><pubDate>Mon, 01 Jan 0001 00:00:00 +0000</pubDate><guid>https://quartz.jzhao.xyz/Daily/2023-06-10/</guid><description>10-06-23 | Saturday Tasks Overdue 1 2 not done due before 2023-06-10 Due today 1 2 not done due on 2023-06-10 Due in the next two weeks 1 2 3 not done due after 2023-06-10 due before {{date+14d:YYYY-MM-DD}} No due date 1 2 not done no due date Done today 1 done on 2023-06-10 Workspace Meditation</description></item><item><title/><link>https://quartz.jzhao.xyz/Daily/2023-06-11/</link><pubDate>Mon, 01 Jan 0001 00:00:00 +0000</pubDate><guid>https://quartz.jzhao.xyz/Daily/2023-06-11/</guid><description>11-06-23 | Sunday Tasks Overdue 1 2 not done due before 2023-06-11 Due today 1 2 not done due on 2023-06-11 Due in the next two weeks 1 2 3 not done due after 2023-06-11 due before {{date+14d:YYYY-MM-DD}} No due date 1 2 not done no due date Done today 1 done on 2023-06-11 Workspace Meditation</description></item><item><title/><link>https://quartz.jzhao.xyz/Daily/2023-06-13/</link><pubDate>Mon, 01 Jan 0001 00:00:00 +0000</pubDate><guid>https://quartz.jzhao.xyz/Daily/2023-06-13/</guid><description>13-06-23 | Tuesday Tasks Overdue 1 2 not done due before 2023-06-13 Due today 1 2 not done due on 2023-06-13 Due in the next two weeks 1 2 3 not done due after 2023-06-13 due before {{date+14d:YYYY-MM-DD}} No due date 1 2 not done no due date Done today 1 done on 2023-06-13 Workspace Meditation</description></item><item><title/><link>https://quartz.jzhao.xyz/Daily/2023-06-14/</link><pubDate>Mon, 01 Jan 0001 00:00:00 +0000</pubDate><guid>https://quartz.jzhao.xyz/Daily/2023-06-14/</guid><description>14-06-23 | Wednesday Tasks Overdue 1 2 not done due before 2023-06-14 Due today 1 2 not done due on 2023-06-14 Due in the next two weeks 1 2 3 not done due after 2023-06-14 due before {{date+14d:YYYY-MM-DD}} No due date 1 2 not done no due date Done today 1 done on 2023-06-14 Workspace Meditation</description></item><item><title/><link>https://quartz.jzhao.xyz/Daily/2023-06-15/</link><pubDate>Mon, 01 Jan 0001 00:00:00 +0000</pubDate><guid>https://quartz.jzhao.xyz/Daily/2023-06-15/</guid><description>15-06-23 | Thursday Tasks Overdue 1 2 not done due before 2023-06-15 Due today 1 2 not done due on 2023-06-15 Due in the next two weeks 1 2 3 not done due after 2023-06-15 due before {{date+14d:YYYY-MM-DD}} No due date 1 2 not done no due date Done today 1 done on 2023-06-15 Workspace Meditation</description></item><item><title/><link>https://quartz.jzhao.xyz/Daily/2023-06-16/</link><pubDate>Mon, 01 Jan 0001 00:00:00 +0000</pubDate><guid>https://quartz.jzhao.xyz/Daily/2023-06-16/</guid><description>16-06-23 | Friday Tasks Overdue 1 2 not done due before 2023-06-16 Due today 1 2 not done due on 2023-06-16 Due in the next two weeks 1 2 3 not done due after 2023-06-16 due before {{date+14d:YYYY-MM-DD}} No due date 1 2 not done no due date Done today 1 done on 2023-06-16 Workspace Meditation</description></item><item><title/><link>https://quartz.jzhao.xyz/Daily/2023-06-19/</link><pubDate>Mon, 01 Jan 0001 00:00:00 +0000</pubDate><guid>https://quartz.jzhao.xyz/Daily/2023-06-19/</guid><description>19-06-23 | Monday Tasks Overdue 1 2 not done due before 2023-06-19 Due today 1 2 not done due on 2023-06-19 Due in the next two weeks 1 2 3 not done due after 2023-06-19 due before {{date+14d:YYYY-MM-DD}} No due date 1 2 not done no due date Done today 1 done on 2023-06-19 Workspace Meditation</description></item><item><title/><link>https://quartz.jzhao.xyz/Daily/2023-06-23/</link><pubDate>Mon, 01 Jan 0001 00:00:00 +0000</pubDate><guid>https://quartz.jzhao.xyz/Daily/2023-06-23/</guid><description>23-06-23 | Friday Tasks Overdue 1 2 not done due before 2023-06-23 Due today 1 2 not done due on 2023-06-23 Due in the next two weeks 1 2 3 not done due after 2023-06-23 due before {{date+14d:YYYY-MM-DD}} No due date 1 2 not done no due date Done today 1 done on 2023-06-23 Workspace Meditation</description></item><item><title/><link>https://quartz.jzhao.xyz/Daily/2023-06-24/</link><pubDate>Mon, 01 Jan 0001 00:00:00 +0000</pubDate><guid>https://quartz.jzhao.xyz/Daily/2023-06-24/</guid><description>24-06-23 | Saturday Tasks Overdue 1 2 not done due before 2023-06-24 Due today 1 2 not done due on 2023-06-24 Due in the next two weeks 1 2 3 not done due after 2023-06-24 due before {{date+14d:YYYY-MM-DD}} No due date 1 2 not done no due date Done today 1 done on 2023-06-24 Workspace Meditation</description></item><item><title/><link>https://quartz.jzhao.xyz/Daily/2023-06-26/</link><pubDate>Mon, 01 Jan 0001 00:00:00 +0000</pubDate><guid>https://quartz.jzhao.xyz/Daily/2023-06-26/</guid><description>26-06-23 | Monday Tasks Overdue 1 2 not done due before 2023-06-26 Due today 1 2 not done due on 2023-06-26 Due in the next two weeks 1 2 3 not done due after 2023-06-26 due before {{date+14d:YYYY-MM-DD}} No due date 1 2 not done no due date Done today 1 done on 2023-06-26 Workspace Meditation</description></item><item><title/><link>https://quartz.jzhao.xyz/Daily/2023-06-27/</link><pubDate>Mon, 01 Jan 0001 00:00:00 +0000</pubDate><guid>https://quartz.jzhao.xyz/Daily/2023-06-27/</guid><description>27-06-23 | Tuesday Tasks Overdue 1 2 not done due before 2023-06-27 Due today 1 2 not done due on 2023-06-27 Due in the next two weeks 1 2 3 not done due after 2023-06-27 due before {{date+14d:YYYY-MM-DD}} No due date 1 2 not done no due date Done today 1 done on 2023-06-27 Workspace Meditation</description></item><item><title/><link>https://quartz.jzhao.xyz/Daily/2023-06-29/</link><pubDate>Mon, 01 Jan 0001 00:00:00 +0000</pubDate><guid>https://quartz.jzhao.xyz/Daily/2023-06-29/</guid><description>29-06-23 | Thursday Tasks Overdue 1 2 not done due before 2023-06-29 Due today 1 2 not done due on 2023-06-29 Due in the next two weeks 1 2 3 not done due after 2023-06-29 due before {{date+14d:YYYY-MM-DD}} No due date 1 2 not done no due date Done today 1 done on 2023-06-29 Workspace Meditation</description></item><item><title/><link>https://quartz.jzhao.xyz/Daily/2023-07-01/</link><pubDate>Mon, 01 Jan 0001 00:00:00 +0000</pubDate><guid>https://quartz.jzhao.xyz/Daily/2023-07-01/</guid><description>01-07-23 | Saturday Tasks Overdue 1 2 not done due before 2023-07-01 Due today 1 2 not done due on 2023-07-01 Due in the next two weeks 1 2 3 not done due after 2023-07-01 due before {{date+14d:YYYY-MM-DD}} No due date 1 2 not done no due date Done today 1 done on 2023-07-01 Start your day by writing down answers to the following questions:</description></item><item><title/><link>https://quartz.jzhao.xyz/Daily/2023-07-02/</link><pubDate>Mon, 01 Jan 0001 00:00:00 +0000</pubDate><guid>https://quartz.jzhao.xyz/Daily/2023-07-02/</guid><description>02-07-23 | Sunday Tasks Overdue 1 2 not done due before 2023-07-02 Due today 1 2 not done due on 2023-07-02 Due in the next two weeks 1 2 3 not done due after 2023-07-02 due before {{date+14d:YYYY-MM-DD}} No due date 1 2 not done no due date Done today 1 done on 2023-07-02 Start your day by writing down answers to the following questions:</description></item><item><title/><link>https://quartz.jzhao.xyz/Daily/2023-07-03/</link><pubDate>Mon, 01 Jan 0001 00:00:00 +0000</pubDate><guid>https://quartz.jzhao.xyz/Daily/2023-07-03/</guid><description>03-07-23 | Monday Tasks Overdue 1 2 not done due before 2023-07-03 Due today 1 2 not done due on 2023-07-03 Due in the next two weeks 1 2 3 not done due after 2023-07-03 due before {{date+14d:YYYY-MM-DD}} No due date 1 2 not done no due date Done today 1 done on 2023-07-03 Start your day by writing down answers to the following questions:</description></item><item><title/><link>https://quartz.jzhao.xyz/Daily/2023-07-04/</link><pubDate>Mon, 01 Jan 0001 00:00:00 +0000</pubDate><guid>https://quartz.jzhao.xyz/Daily/2023-07-04/</guid><description>04-07-23 | Tuesday Tasks Overdue 1 2 not done due before 2023-07-04 Due today 1 2 not done due on 2023-07-04 Due in the next two weeks 1 2 3 not done due after 2023-07-04 due before {{date+14d:YYYY-MM-DD}} No due date 1 2 not done no due date Done today 1 done on 2023-07-04 Start your day by writing down answers to the following questions:</description></item><item><title/><link>https://quartz.jzhao.xyz/Daily/2023-07-06/</link><pubDate>Mon, 01 Jan 0001 00:00:00 +0000</pubDate><guid>https://quartz.jzhao.xyz/Daily/2023-07-06/</guid><description>06-07-23 | Thursday Tasks Overdue 1 2 not done due before 2023-07-06 Due today 1 2 not done due on 2023-07-06 Due in the next two weeks 1 2 3 not done due after 2023-07-06 due before {{date+14d:YYYY-MM-DD}} No due date 1 2 not done no due date Done today 1 done on 2023-07-06 Start your day by writing down answers to the following questions:</description></item><item><title/><link>https://quartz.jzhao.xyz/Daily/2023-07-07/</link><pubDate>Mon, 01 Jan 0001 00:00:00 +0000</pubDate><guid>https://quartz.jzhao.xyz/Daily/2023-07-07/</guid><description>07-07-23 | Friday Tasks Overdue 1 2 not done due before 2023-07-07 Due today 1 2 not done due on 2023-07-07 Due in the next two weeks 1 2 3 not done due after 2023-07-07 due before {{date+14d:YYYY-MM-DD}} No due date 1 2 not done no due date Done today 1 done on 2023-07-07 Start your day by writing down answers to the following questions:</description></item><item><title/><link>https://quartz.jzhao.xyz/Daily/2023-07-09/</link><pubDate>Mon, 01 Jan 0001 00:00:00 +0000</pubDate><guid>https://quartz.jzhao.xyz/Daily/2023-07-09/</guid><description>09-07-23 | Sunday Tasks Overdue 1 2 not done due before 2023-07-09 Due today 1 2 not done due on 2023-07-09 Due in the next two weeks 1 2 3 not done due after 2023-07-09 due before {{date+14d:YYYY-MM-DD}} No due date 1 2 not done no due date Done today 1 done on 2023-07-09 Start your day by writing down answers to the following questions:</description></item><item><title/><link>https://quartz.jzhao.xyz/Daily/2023-07-10/</link><pubDate>Mon, 01 Jan 0001 00:00:00 +0000</pubDate><guid>https://quartz.jzhao.xyz/Daily/2023-07-10/</guid><description>10-07-23 | Monday Tasks Overdue 1 2 not done due before 2023-07-10 Due today 1 2 not done due on 2023-07-10 Due in the next two weeks 1 2 3 not done due after 2023-07-10 due before {{date+14d:YYYY-MM-DD}} No due date 1 2 not done no due date Done today 1 done on 2023-07-10 Start your day by writing down answers to the following questions:</description></item><item><title/><link>https://quartz.jzhao.xyz/Daily/2023-07-11/</link><pubDate>Mon, 01 Jan 0001 00:00:00 +0000</pubDate><guid>https://quartz.jzhao.xyz/Daily/2023-07-11/</guid><description>11-07-23 | Tuesday Tasks Overdue 1 2 not done due before 2023-07-11 Due today 1 2 not done due on 2023-07-11 Due in the next two weeks 1 2 3 not done due after 2023-07-11 due before {{date+14d:YYYY-MM-DD}} No due date 1 2 not done no due date Done today 1 done on 2023-07-11 Start your day by writing down answers to the following questions:</description></item></channel></rss>